[
	{
		"id": "89a566d4-1b84-4a65-b782-a4d3862d11ae",
		"title": "Calculus Study Session",
		"description": "Reviewing derivatives and integrals.",
		"date": "2024-04-03",
		"startTime": "16:30:00-04:00",
		"endTime": "18:30:00-04:00",
		"tags": ["study", "math", "calculus"],
		"location": "University Library, Room 212",
		"image": "https://picsum.photos/300/175.webp"
	},
	{
		"id": "e3d9ecb3-a120-415e-94d0-43dcb951da09",
		"title": "Python Developers Meetup",
		"description": "Networking and talks on Python best practices.",
		"date": "2024-04-17",
		"startTime": "19:00:00-07:00",
		"endTime": "21:30:00-07:00",
		"tags": ["programming", "python", "meetup", "networking"],
		"location": "The Coding Space",
		"image": "https://picsum.photos/300/175.webp"
	},
	{
		"id": "4c0b826c-0e41-4cc8-a1d0-b5de896f486e",
		"title": "Indie Rock Concert",
		"description": "Featuring local bands and rising stars.",
		"date": "2024-04-28",
		"startTime": "20:00:00+01:00",
		"endTime": "23:30:00+01:00",
		"tags": ["music", "concert", "indie", "live"],
		"location": "Downtown Music Hall",
		"image": "https://picsum.photos/300/175.webp"
	},
	{
		"id": "bc9967fe-d91a-4c31-a6f0-8a12ad91153f",
		"title": "Watercolor Painting Workshop",
		"description": "Learn techniques for landscapes and still life.",
		"date": "2024-05-12",
		"startTime": "10:00:00-05:00",
		"endTime": "15:00:00-05:00",
		"tags": ["art", "workshop", "painting", "watercolor"],
		"location": "Community Arts Center",
		"image": "https://picsum.photos/300/175.webp"
	},
	{
		"id": "28d31180-f45e-401b-b049-f60ca894a7eb",
		"title": "Spring Career Fair 2024",
		"description": "Connect with employers across various industries.",
		"date": "2024-05-20",
		"startTime": "11:00:00+02:00",
		"endTime": "17:00:00+02:00",
		"tags": ["career", "job", "fair", "networking"],
		"location": "City Conference Hall",
		"image": "https://picsum.photos/300/175.webp"
	},
	{
		"id": "1d9ab628-e098-4e01-a6d1-4eb80875e4b2",
		"title": "Basketball Championship Finals",
		"description": "The ultimate showdown! Don't miss it.",
		"date": "2024-06-05",
		"startTime": "19:30:00-08:00",
		"endTime": "22:00:00-08:00",
		"tags": ["sports", "basketball", "championship", "game"],
		"location": "City Arena",
		"image": "https://picsum.photos/300/175.webp"
	}
]
